{
  "movement": "Q2",
  "recognised_piece": null,
  "notes": "C minor, contrapuntal texture with the opening motive imitated between hands. Main keys: c, g (bars 9-14, 28-36), Eb (16, 26, 58, 62), f (20, 42-45). Return of the opening at bar 48 beat 3, shifted by two beats. Many local arrivals are inverted or weak, so confidence is low for mid-movement boundaries.",
  "events": [
    {"bar": 1, "beat": 1, "type": "phrase_start", "cadence": "none", "confidence": 0.95},
    {"bar": 7, "beat": 3, "type": "phrase_end", "cadence": "IAC", "confidence": 0.3},
    {"bar": 7, "beat": "3+1/2", "type": "phrase_start", "cadence": "none", "confidence": 0.3},
    {"bar": 11, "beat": 3, "type": "phrase_end", "cadence": "PAC", "confidence": 0.5},
    {"bar": 11, "beat": 3, "type": "phrase_start", "cadence": "none", "confidence": 0.3},
    {"bar": 14, "beat": 1, "type": "cadence", "cadence": "IAC", "confidence": 0.25},
    {"bar": 16, "beat": 1, "type": "phrase_end", "cadence": "PAC", "confidence": 0.55},
    {"bar": 16, "beat": "4+1/2", "type": "phrase_start", "cadence": "none", "confidence": 0.45},
    {"bar": 20, "beat": "3+1/2", "type": "phrase_end", "cadence": "IAC", "confidence": 0.3},
    {"bar": 20, "beat": 4, "type": "phrase_start", "cadence": "none", "confidence": 0.3},
    {"bar": 26, "beat": 1, "type": "phrase_end", "cadence": "IAC", "confidence": 0.45},
    {"bar": 26, "beat": 1, "type": "phrase_start", "cadence": "none", "confidence": 0.45},
    {"bar": 30, "beat": "3+1/2", "type": "phrase_end", "cadence": "IAC", "confidence": 0.3},
    {"bar": 30, "beat": "4+1/2", "type": "phrase_start", "cadence": "none", "confidence": 0.25},
    {"bar": 33, "beat": 1, "type": "phrase_end", "cadence": "HC", "confidence": 0.5},
    {"bar": 33, "beat": 1, "type": "phrase_start", "cadence": "none", "confidence": 0.4},
    {"bar": 36, "beat": 1, "type": "phrase_end", "cadence": "PAC", "confidence": 0.35},
    {"bar": 36, "beat": 1, "type": "phrase_start", "cadence": "none", "confidence": 0.3},
    {"bar": 39, "beat": 1, "type": "phrase_end", "cadence": "IAC", "confidence": 0.45},
    {"bar": 39, "beat": 1, "type": "phrase_start", "cadence": "none", "confidence": 0.45},
    {"bar": 41, "beat": 1, "type": "cadence", "cadence": "IAC", "confidence": 0.25},
    {"bar": 43, "beat": "3+1/2", "type": "phrase_end", "cadence": "IAC", "confidence": 0.3},
    {"bar": 43, "beat": 4, "type": "phrase_start", "cadence": "none", "confidence": 0.3},
    {"bar": 48, "beat": 3, "type": "phrase_end", "cadence": "IAC", "confidence": 0.5},
    {"bar": 48, "beat": 3, "type": "phrase_start", "cadence": "none", "confidence": 0.5},
    {"bar": 53, "beat": 3, "type": "phrase_end", "cadence": "IAC", "confidence": 0.3},
    {"bar": 53, "beat": "3+1/2", "type": "phrase_start", "cadence": "none", "confidence": 0.3},
    {"bar": 58, "beat": 1, "type": "phrase_end", "cadence": "PAC", "confidence": 0.55},
    {"bar": 58, "beat": "4+1/2", "type": "phrase_start", "cadence": "none", "confidence": 0.4},
    {"bar": 62, "beat": 1, "type": "phrase_end", "cadence": "IAC", "confidence": 0.4},
    {"bar": 62, "beat": 1, "type": "phrase_start", "cadence": "none", "confidence": 0.4},
    {"bar": 66, "beat": 1, "type": "phrase_end", "cadence": "IAC", "confidence": 0.45},
    {"bar": 66, "beat": "2+1/2", "type": "phrase_start", "cadence": "none", "confidence": 0.35},
    {"bar": 68, "beat": 1, "type": "cadence", "cadence": "IAC", "confidence": 0.25},
    {"bar": 69, "beat": 1, "type": "cadence", "cadence": "DC", "confidence": 0.5},
    {"bar": 70, "beat": 1, "type": "phrase_end", "cadence": "HC", "confidence": 0.6},
    {"bar": 71, "beat": 1, "type": "phrase_start", "cadence": "none", "confidence": 0.7},
    {"bar": 77, "beat": 1, "type": "phrase_end", "cadence": "PAC", "confidence": 0.85}
  ]
}
