{
  "movement": "Q1",
  "recognised_piece": null,
  "notes": "C minor slow movement in a sonata-like layout: C minor opening, move to Eb at bar 9, Eb closing theme with a deceptive cadence to Cb (bar 25), F minor middle part, augmented-sixth to V of C minor (bar 43), return of the closing theme in C minor (bar 48) with a deceptive cadence to Ab (bar 56), ending on V7 attacca into the next movement. Bar 62 appears to be the first beat of the following movement, so no event is placed there.",
  "events": [
    {"bar": 1, "beat": 1, "type": "phrase_start", "cadence": "none", "confidence": 0.95},
    {"bar": 5, "beat": 1, "type": "phrase_end", "cadence": "HC", "confidence": 0.55},
    {"bar": 5, "beat": 3, "type": "phrase_start", "cadence": "none", "confidence": 0.45},
    {"bar": 7, "beat": 1, "type": "phrase_end", "cadence": "PAC", "confidence": 0.55},
    {"bar": 7, "beat": 1, "type": "phrase_start", "cadence": "none", "confidence": 0.55},
    {"bar": 9, "beat": 1, "type": "phrase_end", "cadence": "IAC", "confidence": 0.35},
    {"bar": 9, "beat": 1, "type": "phrase_start", "cadence": "none", "confidence": 0.45},
    {"bar": 15, "beat": 3, "type": "cadence", "cadence": "IAC", "confidence": 0.25},
    {"bar": 17, "beat": 1, "type": "phrase_end", "cadence": "PAC", "confidence": 0.75},
    {"bar": 17, "beat": 1, "type": "phrase_start", "cadence": "none", "confidence": 0.7},
    {"bar": 21, "beat": 1, "type": "phrase_end", "cadence": "PAC", "confidence": 0.65},
    {"bar": 21, "beat": 1, "type": "phrase_start", "cadence": "none", "confidence": 0.65},
    {"bar": 25, "beat": 1, "type": "cadence", "cadence": "DC", "confidence": 0.6},
    {"bar": 29, "beat": 1, "type": "phrase_end", "cadence": "PAC", "confidence": 0.75},
    {"bar": 29, "beat": 1, "type": "phrase_start", "cadence": "none", "confidence": 0.55},
    {"bar": 31, "beat": 2, "type": "phrase_end", "cadence": "IAC", "confidence": 0.4},
    {"bar": 31, "beat": "3+1/2", "type": "phrase_start", "cadence": "none", "confidence": 0.4},
    {"bar": 33, "beat": 2, "type": "phrase_end", "cadence": "PAC", "confidence": 0.55},
    {"bar": 33, "beat": "3+1/4", "type": "phrase_start", "cadence": "none", "confidence": 0.5},
    {"bar": 39, "beat": 1, "type": "phrase_end", "cadence": "PAC", "confidence": 0.65},
    {"bar": 39, "beat": "3+1/2", "type": "phrase_start", "cadence": "none", "confidence": 0.5},
    {"bar": 43, "beat": 1, "type": "phrase_end", "cadence": "HC", "confidence": 0.7},
    {"bar": 43, "beat": "2+1/2", "type": "phrase_start", "cadence": "none", "confidence": 0.4},
    {"bar": 47, "beat": 1, "type": "phrase_end", "cadence": "HC", "confidence": 0.3},
    {"bar": 48, "beat": 1, "type": "phrase_start", "cadence": "none", "confidence": 0.6},
    {"bar": 52, "beat": 1, "type": "phrase_end", "cadence": "PAC", "confidence": 0.7},
    {"bar": 52, "beat": 1, "type": "phrase_start", "cadence": "none", "confidence": 0.65},
    {"bar": 56, "beat": 1, "type": "cadence", "cadence": "DC", "confidence": 0.6},
    {"bar": 59, "beat": 1, "type": "phrase_end", "cadence": "PAC", "confidence": 0.55},
    {"bar": 59, "beat": 1, "type": "phrase_start", "cadence": "none", "confidence": 0.45},
    {"bar": 61, "beat": 1, "type": "phrase_end", "cadence": "HC", "confidence": 0.55}
  ]
}
