{
 "movement": "Q3",
 "recognised_piece": null,
 "notes": "Theme (minuet-like, G major) with five variations, each 8 + 10 bars with both halves repeated. Same phrase plan in every variation: PAC at score bar 4, HC at score bar 8, dominant arrival (V6/5 or V7 of G) at score bar 12 treated as HC, return at score bar 13, PAC at score bar 18. Var. 4 cadences have the melody displaced off the beat; arrival marked at the bass onset.",
 "events": [
  {
   "bar": 1,
   "beat": 1,
   "type": "phrase_start",
   "cadence": "none",
   "confidence": 0.9
  },
  {
   "bar": 4,
   "beat": 1,
   "type": "phrase_end",
   "cadence": "PAC",
   "confidence": 0.6
  },
  {
   "bar": 5,
   "beat": 1,
   "type": "phrase_start",
   "cadence": "none",
   "confidence": 0.6
  },
  {
   "bar": 8,
   "beat": 1,
   "type": "phrase_end",
   "cadence": "HC",
   "confidence": 0.7
  },
  {
   "bar": 17,
   "beat": 1,
   "type": "phrase_start",
   "cadence": "none",
   "confidence": 0.85
  },
  {
   "bar": 20,
   "beat": 1,
   "type": "phrase_end",
   "cadence": "HC",
   "confidence": 0.4
  },
  {
   "bar": 21,
   "beat": 1,
   "type": "phrase_start",
   "cadence": "none",
   "confidence": 0.45
  },
  {
   "bar": 26,
   "beat": 1,
   "type": "phrase_end",
   "cadence": "PAC",
   "confidence": 0.85
  },
  {
   "bar": 37,
   "beat": 1,
   "type": "phrase_start",
   "cadence": "none",
   "confidence": 0.9
  },
  {
   "bar": 40,
   "beat": 1,
   "type": "phrase_end",
   "cadence": "PAC",
   "confidence": 0.6
  },
  {
   "bar": 41,
   "beat": 1,
   "type": "phrase_start",
   "cadence": "none",
   "confidence": 0.6
  },
  {
   "bar": 44,
   "beat": 1,
   "type": "phrase_end",
   "cadence": "HC",
   "confidence": 0.7
  },
  {
   "bar": 45,
   "beat": 1,
   "type": "phrase_start",
   "cadence": "none",
   "confidence": 0.85
  },
  {
   "bar": 53,
   "beat": 1,
   "type": "phrase_start",
   "cadence": "none",
   "confidence": 0.85
  },
  {
   "bar": 56,
   "beat": 1,
   "type": "phrase_end",
   "cadence": "HC",
   "confidence": 0.4
  },
  {
   "bar": 57,
   "beat": 1,
   "type": "phrase_start",
   "cadence": "none",
   "confidence": 0.45
  },
  {
   "bar": 62,
   "beat": 1,
   "type": "phrase_end",
   "cadence": "PAC",
   "confidence": 0.85
  },
  {
   "bar": 73,
   "beat": 1,
   "type": "phrase_start",
   "cadence": "none",
   "confidence": 0.9
  },
  {
   "bar": 76,
   "beat": 1,
   "type": "phrase_end",
   "cadence": "PAC",
   "confidence": 0.6
  },
  {
   "bar": 77,
   "beat": 1,
   "type": "phrase_start",
   "cadence": "none",
   "confidence": 0.6
  },
  {
   "bar": 80,
   "beat": 1,
   "type": "phrase_end",
   "cadence": "HC",
   "confidence": 0.7
  },
  {
   "bar": 88,
   "beat": 1,
   "type": "phrase_end",
   "cadence": "HC",
   "confidence": 0.7
  },
  {
   "bar": 89,
   "beat": 1,
   "type": "phrase_start",
   "cadence": "none",
   "confidence": 0.85
  },
  {
   "bar": 92,
   "beat": 1,
   "type": "phrase_end",
   "cadence": "HC",
   "confidence": 0.4
  },
  {
   "bar": 93,
   "beat": 1,
   "type": "phrase_start",
   "cadence": "none",
   "confidence": 0.45
  },
  {
   "bar": 98,
   "beat": 1,
   "type": "phrase_end",
   "cadence": "PAC",
   "confidence": 0.85
  },
  {
   "bar": 109,
   "beat": 1,
   "type": "phrase_start",
   "cadence": "none",
   "confidence": 0.9
  },
  {
   "bar": 112,
   "beat": 1,
   "type": "phrase_end",
   "cadence": "PAC",
   "confidence": 0.6
  },
  {
   "bar": 113,
   "beat": 1,
   "type": "phrase_start",
   "cadence": "none",
   "confidence": 0.6
  },
  {
   "bar": 116,
   "beat": 1,
   "type": "phrase_end",
   "cadence": "HC",
   "confidence": 0.7
  },
  {
   "bar": 125,
   "beat": 1,
   "type": "phrase_start",
   "cadence": "none",
   "confidence": 0.85
  },
  {
   "bar": 128,
   "beat": 1,
   "type": "phrase_end",
   "cadence": "HC",
   "confidence": 0.4
  },
  {
   "bar": 129,
   "beat": 1,
   "type": "phrase_start",
   "cadence": "none",
   "confidence": 0.45
  },
  {
   "bar": 134,
   "beat": 1,
   "type": "phrase_end",
   "cadence": "PAC",
   "confidence": 0.85
  },
  {
   "bar": 145,
   "beat": 1,
   "type": "phrase_start",
   "cadence": "none",
   "confidence": 0.9
  },
  {
   "bar": 148,
   "beat": 1,
   "type": "phrase_end",
   "cadence": "PAC",
   "confidence": 0.5
  },
  {
   "bar": 149,
   "beat": 1,
   "type": "phrase_start",
   "cadence": "none",
   "confidence": 0.6
  },
  {
   "bar": 152,
   "beat": 1,
   "type": "phrase_end",
   "cadence": "HC",
   "confidence": 0.7
  },
  {
   "bar": 161,
   "beat": 1,
   "type": "phrase_start",
   "cadence": "none",
   "confidence": 0.85
  },
  {
   "bar": 164,
   "beat": 1,
   "type": "phrase_end",
   "cadence": "HC",
   "confidence": 0.4
  },
  {
   "bar": 165,
   "beat": 1,
   "type": "phrase_start",
   "cadence": "none",
   "confidence": 0.45
  },
  {
   "bar": 170,
   "beat": 1,
   "type": "phrase_end",
   "cadence": "PAC",
   "confidence": 0.8
  },
  {
   "bar": 181,
   "beat": 1,
   "type": "phrase_start",
   "cadence": "none",
   "confidence": 0.9
  },
  {
   "bar": 184,
   "beat": 1,
   "type": "phrase_end",
   "cadence": "PAC",
   "confidence": 0.6
  },
  {
   "bar": 185,
   "beat": 1,
   "type": "phrase_start",
   "cadence": "none",
   "confidence": 0.6
  },
  {
   "bar": 188,
   "beat": 1,
   "type": "phrase_end",
   "cadence": "HC",
   "confidence": 0.7
  },
  {
   "bar": 197,
   "beat": 1,
   "type": "phrase_start",
   "cadence": "none",
   "confidence": 0.85
  },
  {
   "bar": 200,
   "beat": 1,
   "type": "phrase_end",
   "cadence": "HC",
   "confidence": 0.45
  },
  {
   "bar": 201,
   "beat": 1,
   "type": "phrase_start",
   "cadence": "none",
   "confidence": 0.45
  },
  {
   "bar": 206,
   "beat": 1,
   "type": "phrase_end",
   "cadence": "PAC",
   "confidence": 0.85
  }
 ]
}