{
 "movement": "Q5",
 "recognised_piece": null,
 "notes": "Sonata-form movement in Bb; exposition bars 1-53 (repeat 54-106), development + recapitulation 107-173 (repeat 174-240). Recap begins at the transition's arpeggio material (bar 141 = bar 21), not the main theme. Events in repeated bars rely on automatic copying. Bars 7/113 are tonic arrivals over a tonic pedal, labelled PAC with low confidence.",
 "events": [
  {
   "bar": 1,
   "beat": 4,
   "type": "phrase_start",
   "cadence": "none",
   "confidence": 0.9
  },
  {
   "bar": 7,
   "beat": 1,
   "type": "phrase_end",
   "cadence": "PAC",
   "confidence": 0.4
  },
  {
   "bar": 7,
   "beat": 3,
   "type": "phrase_start",
   "cadence": "none",
   "confidence": 0.4
  },
  {
   "bar": 13,
   "beat": 1,
   "type": "phrase_end",
   "cadence": "PAC",
   "confidence": 0.75
  },
  {
   "bar": 13,
   "beat": 1,
   "type": "phrase_start",
   "cadence": "none",
   "confidence": 0.5
  },
  {
   "bar": 15,
   "beat": 1,
   "type": "phrase_end",
   "cadence": "PAC",
   "confidence": 0.55
  },
  {
   "bar": 15,
   "beat": 1,
   "type": "phrase_start",
   "cadence": "none",
   "confidence": 0.5
  },
  {
   "bar": 17,
   "beat": 1,
   "type": "phrase_end",
   "cadence": "PAC",
   "confidence": 0.6
  },
  {
   "bar": 17,
   "beat": 1,
   "type": "phrase_start",
   "cadence": "none",
   "confidence": 0.6
  },
  {
   "bar": 21,
   "beat": 1,
   "type": "phrase_end",
   "cadence": "HC",
   "confidence": 0.6
  },
  {
   "bar": 21,
   "beat": 1,
   "type": "phrase_start",
   "cadence": "none",
   "confidence": 0.45
  },
  {
   "bar": 25,
   "beat": 1,
   "type": "phrase_end",
   "cadence": "IAC",
   "confidence": 0.4
  },
  {
   "bar": 25,
   "beat": 1,
   "type": "phrase_start",
   "cadence": "none",
   "confidence": 0.55
  },
  {
   "bar": 29,
   "beat": 1,
   "type": "phrase_end",
   "cadence": "HC",
   "confidence": 0.45
  },
  {
   "bar": 29,
   "beat": 1,
   "type": "phrase_start",
   "cadence": "none",
   "confidence": 0.4
  },
  {
   "bar": 35,
   "beat": 1,
   "type": "phrase_end",
   "cadence": "PAC",
   "confidence": 0.45
  },
  {
   "bar": 35,
   "beat": 1,
   "type": "phrase_start",
   "cadence": "none",
   "confidence": 0.5
  },
  {
   "bar": 38,
   "beat": 1,
   "type": "phrase_end",
   "cadence": "IAC",
   "confidence": 0.45
  },
  {
   "bar": 38,
   "beat": "3+1/4",
   "type": "phrase_start",
   "cadence": "none",
   "confidence": 0.4
  },
  {
   "bar": 42,
   "beat": 1,
   "type": "phrase_end",
   "cadence": "IAC",
   "confidence": 0.45
  },
  {
   "bar": 42,
   "beat": 1,
   "type": "phrase_start",
   "cadence": "none",
   "confidence": 0.45
  },
  {
   "bar": 47,
   "beat": 1,
   "type": "phrase_end",
   "cadence": "PAC",
   "confidence": 0.7
  },
  {
   "bar": 47,
   "beat": 1,
   "type": "phrase_start",
   "cadence": "none",
   "confidence": 0.5
  },
  {
   "bar": 48,
   "beat": 1,
   "type": "cadence",
   "cadence": "PAC",
   "confidence": 0.3
  },
  {
   "bar": 49,
   "beat": 1,
   "type": "cadence",
   "cadence": "PAC",
   "confidence": 0.3
  },
  {
   "bar": 50,
   "beat": 1,
   "type": "phrase_end",
   "cadence": "PAC",
   "confidence": 0.45
  },
  {
   "bar": 50,
   "beat": 1,
   "type": "phrase_start",
   "cadence": "none",
   "confidence": 0.4
  },
  {
   "bar": 53,
   "beat": 1,
   "type": "phrase_end",
   "cadence": "PAC",
   "confidence": 0.8
  },
  {
   "bar": 107,
   "beat": 1,
   "type": "phrase_start",
   "cadence": "none",
   "confidence": 0.8
  },
  {
   "bar": 113,
   "beat": 1,
   "type": "phrase_end",
   "cadence": "PAC",
   "confidence": 0.4
  },
  {
   "bar": 113,
   "beat": 3,
   "type": "phrase_start",
   "cadence": "none",
   "confidence": 0.4
  },
  {
   "bar": 117,
   "beat": 1,
   "type": "phrase_end",
   "cadence": "IAC",
   "confidence": 0.4
  },
  {
   "bar": 117,
   "beat": 1,
   "type": "phrase_start",
   "cadence": "none",
   "confidence": 0.35
  },
  {
   "bar": 125,
   "beat": 1,
   "type": "phrase_end",
   "cadence": "HC",
   "confidence": 0.55
  },
  {
   "bar": 125,
   "beat": "3+1/2",
   "type": "phrase_start",
   "cadence": "none",
   "confidence": 0.4
  },
  {
   "bar": 129,
   "beat": 1,
   "type": "phrase_end",
   "cadence": "IAC",
   "confidence": 0.35
  },
  {
   "bar": 129,
   "beat": 1,
   "type": "phrase_start",
   "cadence": "none",
   "confidence": 0.3
  },
  {
   "bar": 136,
   "beat": 1,
   "type": "phrase_end",
   "cadence": "HC",
   "confidence": 0.6
  },
  {
   "bar": 141,
   "beat": 1,
   "type": "phrase_start",
   "cadence": "none",
   "confidence": 0.6
  },
  {
   "bar": 145,
   "beat": 1,
   "type": "phrase_end",
   "cadence": "IAC",
   "confidence": 0.4
  },
  {
   "bar": 145,
   "beat": 1,
   "type": "phrase_start",
   "cadence": "none",
   "confidence": 0.55
  },
  {
   "bar": 149,
   "beat": 1,
   "type": "phrase_end",
   "cadence": "HC",
   "confidence": 0.45
  },
  {
   "bar": 149,
   "beat": 1,
   "type": "phrase_start",
   "cadence": "none",
   "confidence": 0.4
  },
  {
   "bar": 155,
   "beat": 1,
   "type": "phrase_end",
   "cadence": "PAC",
   "confidence": 0.45
  },
  {
   "bar": 155,
   "beat": 1,
   "type": "phrase_start",
   "cadence": "none",
   "confidence": 0.5
  },
  {
   "bar": 158,
   "beat": 1,
   "type": "phrase_end",
   "cadence": "IAC",
   "confidence": 0.45
  },
  {
   "bar": 158,
   "beat": "3+1/4",
   "type": "phrase_start",
   "cadence": "none",
   "confidence": 0.4
  },
  {
   "bar": 162,
   "beat": 1,
   "type": "phrase_end",
   "cadence": "IAC",
   "confidence": 0.45
  },
  {
   "bar": 162,
   "beat": 1,
   "type": "phrase_start",
   "cadence": "none",
   "confidence": 0.45
  },
  {
   "bar": 167,
   "beat": 1,
   "type": "phrase_end",
   "cadence": "PAC",
   "confidence": 0.7
  },
  {
   "bar": 167,
   "beat": 1,
   "type": "phrase_start",
   "cadence": "none",
   "confidence": 0.5
  },
  {
   "bar": 168,
   "beat": 1,
   "type": "cadence",
   "cadence": "PAC",
   "confidence": 0.3
  },
  {
   "bar": 169,
   "beat": 1,
   "type": "cadence",
   "cadence": "PAC",
   "confidence": 0.3
  },
  {
   "bar": 170,
   "beat": 1,
   "type": "phrase_end",
   "cadence": "PAC",
   "confidence": 0.45
  },
  {
   "bar": 170,
   "beat": 1,
   "type": "phrase_start",
   "cadence": "none",
   "confidence": 0.4
  },
  {
   "bar": 173,
   "beat": 1,
   "type": "phrase_end",
   "cadence": "PAC",
   "confidence": 0.8
  }
 ]
}