{
  "movement": "Q5",
  "recognised_piece": null,
  "notes": "Sonata-form movement in B-flat. Exposition (bars 1-53, repeated as 54-106) moves to F; second half (107-173, repeated as 174-240) opens with the main theme in F, runs a diminished-seventh sequence to an HC in D minor, retransitions on an F pedal, and recapitulates from the bar-21 material in B-flat. Openings of both halves (bars 7, 113) arrive over a tonic pedal without a clear root-position V, so those cadences are low confidence. Codetta repetitions (13-17, 47-53, 167-173) are marked as short elided phrases.",
  "events": [
    {"bar": 1, "beat": 4, "type": "phrase_start", "cadence": "none", "confidence": 0.95},
    {"bar": 7, "beat": 1, "type": "phrase_end", "cadence": "IAC", "confidence": 0.35},
    {"bar": 7, "beat": 3, "type": "phrase_start", "cadence": "none", "confidence": 0.5},
    {"bar": 13, "beat": 1, "type": "phrase_end", "cadence": "PAC", "confidence": 0.75},
    {"bar": 13, "beat": 1, "type": "phrase_start", "cadence": "none", "confidence": 0.55},
    {"bar": 15, "beat": 1, "type": "phrase_end", "cadence": "PAC", "confidence": 0.5},
    {"bar": 15, "beat": 1, "type": "phrase_start", "cadence": "none", "confidence": 0.45},
    {"bar": 17, "beat": 1, "type": "phrase_end", "cadence": "PAC", "confidence": 0.6},
    {"bar": 17, "beat": 1, "type": "phrase_start", "cadence": "none", "confidence": 0.55},
    {"bar": 21, "beat": 1, "type": "phrase_end", "cadence": "HC", "confidence": 0.4},
    {"bar": 21, "beat": 1, "type": "phrase_start", "cadence": "none", "confidence": 0.45},
    {"bar": 29, "beat": 1, "type": "phrase_end", "cadence": "HC", "confidence": 0.45},
    {"bar": 29, "beat": 1, "type": "phrase_start", "cadence": "none", "confidence": 0.4},
    {"bar": 35, "beat": 1, "type": "phrase_end", "cadence": "PAC", "confidence": 0.35},
    {"bar": 35, "beat": 1, "type": "phrase_start", "cadence": "none", "confidence": 0.55},
    {"bar": 38, "beat": 1, "type": "phrase_end", "cadence": "IAC", "confidence": 0.45},
    {"bar": 38, "beat": "3+1/4", "type": "phrase_start", "cadence": "none", "confidence": 0.4},
    {"bar": 42, "beat": 1, "type": "phrase_end", "cadence": "IAC", "confidence": 0.4},
    {"bar": 42, "beat": 1, "type": "phrase_start", "cadence": "none", "confidence": 0.35},
    {"bar": 47, "beat": 1, "type": "phrase_end", "cadence": "PAC", "confidence": 0.7},
    {"bar": 47, "beat": 1, "type": "phrase_start", "cadence": "none", "confidence": 0.55},
    {"bar": 50, "beat": 1, "type": "phrase_end", "cadence": "PAC", "confidence": 0.4},
    {"bar": 50, "beat": 1, "type": "phrase_start", "cadence": "none", "confidence": 0.35},
    {"bar": 53, "beat": 1, "type": "phrase_end", "cadence": "PAC", "confidence": 0.75},
    {"bar": 107, "beat": 1, "type": "phrase_start", "cadence": "none", "confidence": 0.85},
    {"bar": 113, "beat": 1, "type": "phrase_end", "cadence": "IAC", "confidence": 0.35},
    {"bar": 113, "beat": 3, "type": "phrase_start", "cadence": "none", "confidence": 0.5},
    {"bar": 117, "beat": 1, "type": "phrase_end", "cadence": "PAC", "confidence": 0.4},
    {"bar": 117, "beat": 1, "type": "phrase_start", "cadence": "none", "confidence": 0.4},
    {"bar": 125, "beat": 1, "type": "phrase_end", "cadence": "HC", "confidence": 0.55},
    {"bar": 125, "beat": "3+1/2", "type": "phrase_start", "cadence": "none", "confidence": 0.35},
    {"bar": 129, "beat": 1, "type": "phrase_end", "cadence": "IAC", "confidence": 0.35},
    {"bar": 129, "beat": 1, "type": "phrase_start", "cadence": "none", "confidence": 0.35},
    {"bar": 136, "beat": 1, "type": "phrase_end", "cadence": "HC", "confidence": 0.5},
    {"bar": 136, "beat": 1, "type": "phrase_start", "cadence": "none", "confidence": 0.4},
    {"bar": 140, "beat": 1, "type": "phrase_end", "cadence": "HC", "confidence": 0.3},
    {"bar": 141, "beat": 1, "type": "phrase_start", "cadence": "none", "confidence": 0.6},
    {"bar": 149, "beat": 1, "type": "phrase_end", "cadence": "HC", "confidence": 0.5},
    {"bar": 149, "beat": 1, "type": "phrase_start", "cadence": "none", "confidence": 0.45},
    {"bar": 155, "beat": 1, "type": "phrase_end", "cadence": "PAC", "confidence": 0.35},
    {"bar": 155, "beat": 1, "type": "phrase_start", "cadence": "none", "confidence": 0.55},
    {"bar": 158, "beat": 1, "type": "phrase_end", "cadence": "IAC", "confidence": 0.45},
    {"bar": 158, "beat": "3+1/4", "type": "phrase_start", "cadence": "none", "confidence": 0.4},
    {"bar": 162, "beat": 1, "type": "phrase_end", "cadence": "IAC", "confidence": 0.4},
    {"bar": 162, "beat": 1, "type": "phrase_start", "cadence": "none", "confidence": 0.35},
    {"bar": 167, "beat": 1, "type": "phrase_end", "cadence": "PAC", "confidence": 0.7},
    {"bar": 167, "beat": 1, "type": "phrase_start", "cadence": "none", "confidence": 0.55},
    {"bar": 170, "beat": 1, "type": "phrase_end", "cadence": "PAC", "confidence": 0.4},
    {"bar": 170, "beat": 1, "type": "phrase_start", "cadence": "none", "confidence": 0.35},
    {"bar": 173, "beat": 1, "type": "phrase_end", "cadence": "PAC", "confidence": 0.75}
  ]
}
