{
  "movement": "Q3",
  "recognised_piece": null,
  "notes": "Theme (18 bars, ||: 8 :||: 10 :||) and five variations in G major; the final 'Min. D.C.' suggests a variation trio within a minuet movement. Same plan annotated in each: A = 4-bar phrase to PAC + 4-bar phrase to HC (via vii7/V); B = 4-bar sequence to V7 (HC), then 6-bar phrase whose two-bar units touch V6 before the cadential 6/4-V7-I PAC. Weak V6 endings inside the B second phrase not marked. Bar 45 is printed separately from bar 37, so its phrase start is added explicitly; bars 86-88 likewise.",
  "events": [
    {"bar": 1, "beat": 1, "type": "phrase_start", "cadence": "none", "confidence": 0.95},
    {"bar": 4, "beat": 1, "type": "phrase_end", "cadence": "PAC", "confidence": 0.7},
    {"bar": 5, "beat": 1, "type": "phrase_start", "cadence": "none", "confidence": 0.7},
    {"bar": 8, "beat": 1, "type": "phrase_end", "cadence": "HC", "confidence": 0.75},
    {"bar": 17, "beat": 1, "type": "phrase_start", "cadence": "none", "confidence": 0.85},
    {"bar": 20, "beat": 1, "type": "phrase_end", "cadence": "HC", "confidence": 0.6},
    {"bar": 21, "beat": 1, "type": "phrase_start", "cadence": "none", "confidence": 0.6},
    {"bar": 26, "beat": 1, "type": "phrase_end", "cadence": "PAC", "confidence": 0.85},
    {"bar": 37, "beat": 1, "type": "phrase_start", "cadence": "none", "confidence": 0.9},
    {"bar": 40, "beat": 1, "type": "phrase_end", "cadence": "PAC", "confidence": 0.65},
    {"bar": 41, "beat": 1, "type": "phrase_start", "cadence": "none", "confidence": 0.65},
    {"bar": 44, "beat": 1, "type": "phrase_end", "cadence": "HC", "confidence": 0.7},
    {"bar": 45, "beat": 1, "type": "phrase_start", "cadence": "none", "confidence": 0.9},
    {"bar": 53, "beat": 1, "type": "phrase_start", "cadence": "none", "confidence": 0.85},
    {"bar": 56, "beat": 1, "type": "phrase_end", "cadence": "HC", "confidence": 0.6},
    {"bar": 57, "beat": 1, "type": "phrase_start", "cadence": "none", "confidence": 0.6},
    {"bar": 62, "beat": 1, "type": "phrase_end", "cadence": "PAC", "confidence": 0.85},
    {"bar": 73, "beat": 1, "type": "phrase_start", "cadence": "none", "confidence": 0.9},
    {"bar": 76, "beat": 1, "type": "phrase_end", "cadence": "PAC", "confidence": 0.65},
    {"bar": 77, "beat": 1, "type": "phrase_start", "cadence": "none", "confidence": 0.65},
    {"bar": 80, "beat": 1, "type": "phrase_end", "cadence": "HC", "confidence": 0.7},
    {"bar": 88, "beat": 1, "type": "phrase_end", "cadence": "HC", "confidence": 0.7},
    {"bar": 89, "beat": 1, "type": "phrase_start", "cadence": "none", "confidence": 0.85},
    {"bar": 92, "beat": 1, "type": "phrase_end", "cadence": "HC", "confidence": 0.6},
    {"bar": 93, "beat": 1, "type": "phrase_start", "cadence": "none", "confidence": 0.6},
    {"bar": 98, "beat": 1, "type": "phrase_end", "cadence": "PAC", "confidence": 0.85},
    {"bar": 109, "beat": 1, "type": "phrase_start", "cadence": "none", "confidence": 0.9},
    {"bar": 112, "beat": 1, "type": "phrase_end", "cadence": "PAC", "confidence": 0.65},
    {"bar": 113, "beat": 1, "type": "phrase_start", "cadence": "none", "confidence": 0.65},
    {"bar": 116, "beat": 1, "type": "phrase_end", "cadence": "HC", "confidence": 0.7},
    {"bar": 125, "beat": 1, "type": "phrase_start", "cadence": "none", "confidence": 0.85},
    {"bar": 128, "beat": 1, "type": "phrase_end", "cadence": "HC", "confidence": 0.6},
    {"bar": 129, "beat": 1, "type": "phrase_start", "cadence": "none", "confidence": 0.6},
    {"bar": 134, "beat": 1, "type": "phrase_end", "cadence": "PAC", "confidence": 0.85},
    {"bar": 145, "beat": 1, "type": "phrase_start", "cadence": "none", "confidence": 0.9},
    {"bar": 148, "beat": 1, "type": "phrase_end", "cadence": "PAC", "confidence": 0.6},
    {"bar": 149, "beat": 1, "type": "phrase_start", "cadence": "none", "confidence": 0.65},
    {"bar": 152, "beat": 1, "type": "phrase_end", "cadence": "HC", "confidence": 0.7},
    {"bar": 161, "beat": 1, "type": "phrase_start", "cadence": "none", "confidence": 0.85},
    {"bar": 164, "beat": 1, "type": "phrase_end", "cadence": "HC", "confidence": 0.6},
    {"bar": 165, "beat": 1, "type": "phrase_start", "cadence": "none", "confidence": 0.6},
    {"bar": 170, "beat": 1, "type": "phrase_end", "cadence": "PAC", "confidence": 0.8},
    {"bar": 181, "beat": 1, "type": "phrase_start", "cadence": "none", "confidence": 0.9},
    {"bar": 184, "beat": 1, "type": "phrase_end", "cadence": "PAC", "confidence": 0.65},
    {"bar": 185, "beat": 1, "type": "phrase_start", "cadence": "none", "confidence": 0.65},
    {"bar": 188, "beat": 1, "type": "phrase_end", "cadence": "HC", "confidence": 0.7},
    {"bar": 197, "beat": 1, "type": "phrase_start", "cadence": "none", "confidence": 0.85},
    {"bar": 200, "beat": 1, "type": "phrase_end", "cadence": "HC", "confidence": 0.6},
    {"bar": 201, "beat": 1, "type": "phrase_start", "cadence": "none", "confidence": 0.6},
    {"bar": 206, "beat": 1, "type": "phrase_end", "cadence": "PAC", "confidence": 0.85}
  ]
}
