{
 "movement": "Q4",
 "recognised_piece": null,
 "notes": "Sonata form in G, exposition modulates to D, development touches E minor, recap in G. Cadences at bars 7 and 85 sit over a tonic pedal with a V6 on the last beat, so PAC vs IAC is uncertain. Bars 11-15 and 16-21 (transition to D) are ambiguous; HC placements there are low-confidence.",
 "events": [
  {
   "bar": 1,
   "beat": 4,
   "type": "phrase_start",
   "cadence": "none",
   "confidence": 0.85
  },
  {
   "bar": 7,
   "beat": 1,
   "type": "phrase_end",
   "cadence": "PAC",
   "confidence": 0.5
  },
  {
   "bar": 7,
   "beat": 1,
   "type": "phrase_start",
   "cadence": "none",
   "confidence": 0.5
  },
  {
   "bar": 15,
   "beat": 1,
   "type": "phrase_end",
   "cadence": "HC",
   "confidence": 0.35
  },
  {
   "bar": 15,
   "beat": "1+1/4",
   "type": "phrase_start",
   "cadence": "none",
   "confidence": 0.35
  },
  {
   "bar": 20,
   "beat": 1,
   "type": "phrase_end",
   "cadence": "HC",
   "confidence": 0.4
  },
  {
   "bar": 22,
   "beat": 1,
   "type": "phrase_start",
   "cadence": "none",
   "confidence": 0.6
  },
  {
   "bar": 29,
   "beat": 1,
   "type": "phrase_end",
   "cadence": "IAC",
   "confidence": 0.4
  },
  {
   "bar": 29,
   "beat": "3+1/2",
   "type": "phrase_start",
   "cadence": "none",
   "confidence": 0.55
  },
  {
   "bar": 33,
   "beat": 1,
   "type": "phrase_end",
   "cadence": "PAC",
   "confidence": 0.7
  },
  {
   "bar": 33,
   "beat": "3+1/2",
   "type": "phrase_start",
   "cadence": "none",
   "confidence": 0.6
  },
  {
   "bar": 37,
   "beat": 1,
   "type": "phrase_end",
   "cadence": "PAC",
   "confidence": 0.7
  },
  {
   "bar": 37,
   "beat": 1,
   "type": "phrase_start",
   "cadence": "none",
   "confidence": 0.55
  },
  {
   "bar": 39,
   "beat": 1,
   "type": "phrase_end",
   "cadence": "PAC",
   "confidence": 0.6
  },
  {
   "bar": 79,
   "beat": 1,
   "type": "phrase_start",
   "cadence": "none",
   "confidence": 0.7
  },
  {
   "bar": 85,
   "beat": 1,
   "type": "phrase_end",
   "cadence": "PAC",
   "confidence": 0.5
  },
  {
   "bar": 85,
   "beat": 1,
   "type": "phrase_start",
   "cadence": "none",
   "confidence": 0.5
  },
  {
   "bar": 94,
   "beat": 1,
   "type": "phrase_end",
   "cadence": "HC",
   "confidence": 0.35
  },
  {
   "bar": 94,
   "beat": 1,
   "type": "phrase_start",
   "cadence": "none",
   "confidence": 0.35
  },
  {
   "bar": 99,
   "beat": 1,
   "type": "phrase_end",
   "cadence": "IAC",
   "confidence": 0.4
  },
  {
   "bar": 99,
   "beat": 1,
   "type": "phrase_start",
   "cadence": "none",
   "confidence": 0.4
  },
  {
   "bar": 103,
   "beat": 1,
   "type": "phrase_end",
   "cadence": "PAC",
   "confidence": 0.5
  },
  {
   "bar": 103,
   "beat": 1,
   "type": "phrase_start",
   "cadence": "none",
   "confidence": 0.5
  },
  {
   "bar": 106,
   "beat": 1,
   "type": "phrase_end",
   "cadence": "HC",
   "confidence": 0.5
  },
  {
   "bar": 108,
   "beat": 4,
   "type": "phrase_start",
   "cadence": "none",
   "confidence": 0.75
  },
  {
   "bar": 114,
   "beat": 1,
   "type": "phrase_end",
   "cadence": "PAC",
   "confidence": 0.5
  },
  {
   "bar": 114,
   "beat": 1,
   "type": "phrase_start",
   "cadence": "none",
   "confidence": 0.5
  },
  {
   "bar": 120,
   "beat": 1,
   "type": "phrase_end",
   "cadence": "HC",
   "confidence": 0.4
  },
  {
   "bar": 122,
   "beat": 1,
   "type": "phrase_start",
   "cadence": "none",
   "confidence": 0.6
  },
  {
   "bar": 129,
   "beat": 1,
   "type": "phrase_end",
   "cadence": "PAC",
   "confidence": 0.5
  },
  {
   "bar": 129,
   "beat": "3+1/2",
   "type": "phrase_start",
   "cadence": "none",
   "confidence": 0.55
  },
  {
   "bar": 133,
   "beat": 1,
   "type": "phrase_end",
   "cadence": "PAC",
   "confidence": 0.7
  },
  {
   "bar": 133,
   "beat": "3+1/2",
   "type": "phrase_start",
   "cadence": "none",
   "confidence": 0.6
  },
  {
   "bar": 137,
   "beat": 1,
   "type": "phrase_end",
   "cadence": "IAC",
   "confidence": 0.45
  },
  {
   "bar": 137,
   "beat": 1,
   "type": "phrase_start",
   "cadence": "none",
   "confidence": 0.45
  },
  {
   "bar": 139,
   "beat": 1,
   "type": "phrase_end",
   "cadence": "PAC",
   "confidence": 0.6
  }
 ]
}