{
 "movement": "Q4",
 "recognised_piece": null,
 "notes": "Sonata-form movement in G major, exposition to D (bars 1-39, repeated as 40-78), development bars 79-108 via E minor, recapitulation from bar 108 beat 4 (79-139 repeated as 140-200). Bars 106-108 (dominant pedal before the recap) are treated as a link after the HC at bar 106. Not confidently identified.",
 "events": [
  {
   "bar": 1,
   "beat": 4,
   "type": "phrase_start",
   "cadence": "none",
   "confidence": 0.8
  },
  {
   "bar": 7,
   "beat": 1,
   "type": "phrase_end",
   "cadence": "IAC",
   "confidence": 0.5
  },
  {
   "bar": 7,
   "beat": 1,
   "type": "phrase_start",
   "cadence": "none",
   "confidence": 0.45
  },
  {
   "bar": 13,
   "beat": 1,
   "type": "phrase_end",
   "cadence": "HC",
   "confidence": 0.6
  },
  {
   "bar": 13,
   "beat": 4,
   "type": "phrase_start",
   "cadence": "none",
   "confidence": 0.55
  },
  {
   "bar": 15,
   "beat": 1,
   "type": "phrase_end",
   "cadence": "HC",
   "confidence": 0.45
  },
  {
   "bar": 15,
   "beat": "1+1/4",
   "type": "phrase_start",
   "cadence": "none",
   "confidence": 0.35
  },
  {
   "bar": 22,
   "beat": 1,
   "type": "phrase_end",
   "cadence": "IAC",
   "confidence": 0.45
  },
  {
   "bar": 22,
   "beat": 1,
   "type": "phrase_start",
   "cadence": "none",
   "confidence": 0.6
  },
  {
   "bar": 29,
   "beat": 1,
   "type": "phrase_end",
   "cadence": "IAC",
   "confidence": 0.5
  },
  {
   "bar": 29,
   "beat": "3+1/2",
   "type": "phrase_start",
   "cadence": "none",
   "confidence": 0.6
  },
  {
   "bar": 33,
   "beat": 1,
   "type": "phrase_end",
   "cadence": "PAC",
   "confidence": 0.7
  },
  {
   "bar": 33,
   "beat": "3+1/2",
   "type": "phrase_start",
   "cadence": "none",
   "confidence": 0.6
  },
  {
   "bar": 37,
   "beat": 1,
   "type": "phrase_end",
   "cadence": "PAC",
   "confidence": 0.65
  },
  {
   "bar": 37,
   "beat": 1,
   "type": "phrase_start",
   "cadence": "none",
   "confidence": 0.5
  },
  {
   "bar": 39,
   "beat": 1,
   "type": "phrase_end",
   "cadence": "PAC",
   "confidence": 0.6
  },
  {
   "bar": 79,
   "beat": 1,
   "type": "phrase_start",
   "cadence": "none",
   "confidence": 0.7
  },
  {
   "bar": 85,
   "beat": 1,
   "type": "phrase_end",
   "cadence": "IAC",
   "confidence": 0.5
  },
  {
   "bar": 85,
   "beat": 1,
   "type": "phrase_start",
   "cadence": "none",
   "confidence": 0.4
  },
  {
   "bar": 94,
   "beat": 1,
   "type": "phrase_end",
   "cadence": "HC",
   "confidence": 0.4
  },
  {
   "bar": 94,
   "beat": 1,
   "type": "phrase_start",
   "cadence": "none",
   "confidence": 0.35
  },
  {
   "bar": 99,
   "beat": 1,
   "type": "phrase_end",
   "cadence": "IAC",
   "confidence": 0.4
  },
  {
   "bar": 99,
   "beat": 1,
   "type": "phrase_start",
   "cadence": "none",
   "confidence": 0.4
  },
  {
   "bar": 103,
   "beat": 1,
   "type": "phrase_end",
   "cadence": "PAC",
   "confidence": 0.5
  },
  {
   "bar": 103,
   "beat": 1,
   "type": "phrase_start",
   "cadence": "none",
   "confidence": 0.45
  },
  {
   "bar": 106,
   "beat": 1,
   "type": "phrase_end",
   "cadence": "HC",
   "confidence": 0.5
  },
  {
   "bar": 108,
   "beat": 4,
   "type": "phrase_start",
   "cadence": "none",
   "confidence": 0.7
  },
  {
   "bar": 114,
   "beat": 1,
   "type": "phrase_end",
   "cadence": "PAC",
   "confidence": 0.55
  },
  {
   "bar": 114,
   "beat": 1,
   "type": "phrase_start",
   "cadence": "none",
   "confidence": 0.45
  },
  {
   "bar": 122,
   "beat": 1,
   "type": "phrase_end",
   "cadence": "IAC",
   "confidence": 0.45
  },
  {
   "bar": 122,
   "beat": 1,
   "type": "phrase_start",
   "cadence": "none",
   "confidence": 0.6
  },
  {
   "bar": 129,
   "beat": 1,
   "type": "phrase_end",
   "cadence": "PAC",
   "confidence": 0.55
  },
  {
   "bar": 129,
   "beat": "3+1/2",
   "type": "phrase_start",
   "cadence": "none",
   "confidence": 0.6
  },
  {
   "bar": 133,
   "beat": 1,
   "type": "phrase_end",
   "cadence": "PAC",
   "confidence": 0.7
  },
  {
   "bar": 133,
   "beat": "3+1/2",
   "type": "phrase_start",
   "cadence": "none",
   "confidence": 0.6
  },
  {
   "bar": 137,
   "beat": 1,
   "type": "phrase_end",
   "cadence": "IAC",
   "confidence": 0.5
  },
  {
   "bar": 137,
   "beat": 1,
   "type": "phrase_start",
   "cadence": "none",
   "confidence": 0.45
  },
  {
   "bar": 139,
   "beat": 1,
   "type": "phrase_end",
   "cadence": "PAC",
   "confidence": 0.65
  }
 ]
}