{
  "movement": "Q1",
  "recognised_piece": null,
  "notes": "Sonata-form movement in C minor, second group in Eb; the recapitulation starts with the closing theme in C minor (bar 48). Deceptive moves to bVI at bars 25 and 56 expand the closing phrases. Bars 9-11 treated as tonic prolongation after the move to Eb. The movement ends on the dominant and runs straight on into the next movement (bar 62).",
  "events": [
    {"bar": 1, "beat": 1, "type": "phrase_start", "cadence": "none", "confidence": 0.95},
    {"bar": 7, "beat": 1, "type": "phrase_end", "cadence": "PAC", "confidence": 0.6},
    {"bar": 7, "beat": 1, "type": "phrase_start", "cadence": "none", "confidence": 0.6},
    {"bar": 9, "beat": 1, "type": "phrase_end", "cadence": "IAC", "confidence": 0.4},
    {"bar": 11, "beat": "3+1/2", "type": "phrase_start", "cadence": "none", "confidence": 0.45},
    {"bar": 17, "beat": 1, "type": "phrase_end", "cadence": "PAC", "confidence": 0.7},
    {"bar": 17, "beat": 1, "type": "phrase_start", "cadence": "none", "confidence": 0.65},
    {"bar": 21, "beat": 1, "type": "phrase_end", "cadence": "PAC", "confidence": 0.65},
    {"bar": 21, "beat": 1, "type": "phrase_start", "cadence": "none", "confidence": 0.6},
    {"bar": 25, "beat": 1, "type": "cadence", "cadence": "DC", "confidence": 0.6},
    {"bar": 29, "beat": 1, "type": "phrase_end", "cadence": "PAC", "confidence": 0.7},
    {"bar": 29, "beat": 1, "type": "phrase_start", "cadence": "none", "confidence": 0.5},
    {"bar": 31, "beat": 2, "type": "phrase_end", "cadence": "IAC", "confidence": 0.4},
    {"bar": 31, "beat": "3+1/2", "type": "phrase_start", "cadence": "none", "confidence": 0.45},
    {"bar": 33, "beat": 2, "type": "phrase_end", "cadence": "PAC", "confidence": 0.55},
    {"bar": 33, "beat": "3+1/4", "type": "phrase_start", "cadence": "none", "confidence": 0.5},
    {"bar": 39, "beat": 1, "type": "phrase_end", "cadence": "PAC", "confidence": 0.6},
    {"bar": 39, "beat": "3+1/2", "type": "phrase_start", "cadence": "none", "confidence": 0.55},
    {"bar": 41, "beat": 1, "type": "phrase_end", "cadence": "IAC", "confidence": 0.35},
    {"bar": 41, "beat": "3+1/2", "type": "phrase_start", "cadence": "none", "confidence": 0.35},
    {"bar": 43, "beat": 1, "type": "phrase_end", "cadence": "HC", "confidence": 0.65},
    {"bar": 43, "beat": "2+1/2", "type": "phrase_start", "cadence": "none", "confidence": 0.4},
    {"bar": 47, "beat": 1, "type": "phrase_end", "cadence": "HC", "confidence": 0.3},
    {"bar": 48, "beat": 1, "type": "phrase_start", "cadence": "none", "confidence": 0.7},
    {"bar": 52, "beat": 1, "type": "phrase_end", "cadence": "PAC", "confidence": 0.65},
    {"bar": 52, "beat": 1, "type": "phrase_start", "cadence": "none", "confidence": 0.6},
    {"bar": 56, "beat": 1, "type": "cadence", "cadence": "DC", "confidence": 0.6},
    {"bar": 59, "beat": 1, "type": "phrase_end", "cadence": "PAC", "confidence": 0.55},
    {"bar": 59, "beat": 1, "type": "phrase_start", "cadence": "none", "confidence": 0.45},
    {"bar": 61, "beat": 1, "type": "phrase_end", "cadence": "HC", "confidence": 0.45}
  ]
}
